<?xml version="1.0" encoding="UTF-8"?>
<domande xmlns:xsi="http://www.w3.org/2001/XMLSchema-instance" xsi:noNamespaceSchemaLocation="../schema/schemaDomande.xsd"><domanda id="1" faq="true" data="2024-07-18" id_utente="2"><contenuto>Avete una sede fisica?</contenuto><valutazioni><valutazione id_utente="4" peso="13" rating="5"/></valutazioni></domanda><domanda id="2" faq="true" data="2024-07-18" id_utente="3"><contenuto>Si pu√≤ cambiare l'indirizzo di consegna?</contenuto><valutazioni><valutazione id_utente="1" peso="200" rating="1"/></valutazioni></domanda></domande>
