<?xml version="1.0" encoding="UTF-8"?>
<domande xmlns:xsi="http://www.w3.org/2001/XMLSchema-instance" xsi:noNamespaceSchemaLocation="../schema/schemaDomande.xsd"><domanda id="1" faq="true" data="2024-07-26" id_utente="3"><contenuto>Avete una sede fisica?</contenuto><valutazioni><valutazione id_utente="4" peso="1" rating="3"/><valutazione id_utente="1" peso="200" rating="4"/></valutazioni></domanda><domanda id="2" faq="false" data="2024-07-26" id_utente="4"><contenuto>Si pu√≤ modificare l'indirizzo di consegna?</contenuto><valutazioni><valutazione id_utente="3" peso="1" rating="4"/></valutazioni></domanda><domanda id="3" faq="true" data="2024-07-26" id_utente="1"><contenuto>Quanto dura la garanzia sui prodotti?</contenuto><valutazioni/></domanda></domande>
